{
  "$schema": "./layout-spec-schema.json",
  "meta": {
    "id": "layout-form-wide",
    "label": "Form Wide",
    "description": "Breites Formular-Layout fuer mehrspaltige Formulare. Standard-Container statt schmalem Container.",
    "extends": "layout-form",
    "tags": ["form", "wide", "multi-column"],
    "templateClass": ".t-form-wide"
  },
  "container": {
    "ref": "container.standard",
    "overrides": {}
  },
  "grid": {
    "ref": "grid.default",
    "overrides": {}
  },
  "spacing": {
    "ref": "spacing.component",
    "overrides": {}
  },
  "section": {
    "ref": "section.default",
    "overrides": {}
  }
}
