{
  "$schema": "./layout-spec-schema.json",
  "meta": {
    "id": "layout-docs-narrow",
    "label": "Documentation Narrow",
    "description": "Schmales Dokumentations-Layout fuer fokussiertes Lesen. Ideale Zeilenlaenge fuer Prosa.",
    "extends": "layout-docs",
    "tags": ["docs", "narrow", "reading"],
    "templateClass": ".t-docs-narrow"
  },
  "container": {
    "ref": "container.narrow",
    "overrides": {}
  },
  "grid": {
    "ref": "grid.default",
    "overrides": {}
  },
  "spacing": {
    "ref": "spacing.component",
    "overrides": {}
  },
  "section": {
    "ref": "section.default",
    "overrides": {}
  }
}
