{
  "$schema": "./layout-spec-schema.json",
  "meta": {
    "id": "layout-docs-wide",
    "label": "Documentation Wide",
    "description": "Breiteres Dokumentations-Layout fuer Seiten mit Tabellen, Diagrammen oder Side-by-Side-Vergleichen.",
    "extends": "layout-docs",
    "tags": ["docs", "wide"],
    "templateClass": ".t-docs-wide"
  },
  "container": {
    "ref": "container.wide",
    "overrides": {}
  },
  "grid": {
    "ref": "grid.default",
    "overrides": {}
  },
  "spacing": {
    "ref": "spacing.component",
    "overrides": {}
  },
  "section": {
    "ref": "section.default",
    "overrides": {}
  }
}
